Question_ID,Category,Question,Ground_Truth_Answer,Real_LLaMA_Answer,Retrieved_Passages,Retrieved_Distances,Retrieved_Sources
AA169,Aggression,"As a caregiver, I've been noticing some aggressive behavior in my loved one with dementia. Could you let me know about common factors that might trigger such behaviour?","Aggressive behavior in dementia can result from a variety of factors. Common triggers include:

1. Environmental Factors: Loud noise, clutter, or a large number of people in the room can cause agitation.
2. Physical Discomfort: They could be hungry, tired, in pain, or need to use the bathroom.
3. Health Problems: Infections or illnesses can worsen dementia symptoms and trigger aggression.
4. Difficulty with Complex Tasks: Frustration from tasks like getting dressed can lead to outbursts.
5. Poor Communication: If they are unable to understand you or express their feelings, aggression can result.
6. Changes in Routine: People with dementia may become upset if their daily routine is changed.
7. Fear and Anxiety: Dementia can make the world a confusing place, causing fear which they respond to with aggression.

As a caregiver, understanding these triggers can be beneficial in avoiding or reducing aggressive behaviors.",Failed to generate answer after 2 attempts,"[""evaluation, respectively [10]. In a recent cross-sectional study, Charernboon and Phanasathit\nobserved high rates of agitation, aggression, aberrant motor behaviors, and sleep problems in\npatients with AD, and found that the frequency of symptoms increased with the severity of\nillness [11]. Moreover, over 60% of participants presented with a chief complaint of\nbehavioral symptoms, which was more frequent than memory complaints [11]. In the\nprimary care setting, Thyrian and colleagues found that behavioral symptoms are common\nin individuals screening positive for dementia, and identified aggression, anxiety,\ndisinhibition, and delusions as “severely to extremely” distressing in more than 30% of cases\nidentified [12].\nAgitation and irritability in AD are associated with greater caregiver str"", ""behaviors, and these discrepancies were especially prevalent in patients with mild dementia\n[21]. Furthermore, caregiver communication styles, expectations, over- and underestimation\nof patient abilities, and cultural beliefs may all influence the very behaviors being observed\n[13].\nTo minimize ambiguity, agitation, irritability, and other challenging behaviors should be\ndescribed in clear language that can be understood by all members of the care team. In fact,\nit is often helpful to avoid using ambiguous terms such as “agitation” and “irritability,” and\ninstead describe the particular actions, responses, or emotional expressions observed in the\npatient. It is also important to identify the time course of the symptoms in question,\nincluding the context in which they first emerged, how fre"", ""movements, socially inappropriate disinhibition, and wandering [2]. Cohen-Mansfield, a\nleader in this area, has identified four distinct categories of agitation in AD, including (1)\nphysically non-aggressive behaviors, (2) verbally non-aggressive behaviors, (3) physically\naggressive behaviors, and (4) verbally aggressive behaviors [4]. While helpful from a\nnosological perspective, these labels are not consistently used in clinical settings or even in\nAD research [20]. For clinicians and researchers alike, however, it is critical to accurately\ndescribe the specific symptom or behavior of concern, as doing so may provide a framework\nfor understanding its etiology, promote selection of an appropriate intervention, and offer a\nmeans for tracking its progression over time in terms of severity, ""]","[null, null, null, null, null, null, null, null, null, null]","[""/Users/gengminjie/Desktop/code/RAG/deployment_package/rag_versions/rag_system/code/downloaded_files/Psychological Symptoms/Irritability/nihms-1020336.pdf"", ""/Users/gengminjie/Desktop/code/RAG/deployment_package/rag_versions/rag_system/code/downloaded_files/Psychological Symptoms/Irritability/nihms-1020336.pdf"", ""/Users/gengminjie/Desktop/code/RAG/deployment_package/rag_versions/rag_system/code/downloaded_files/Psychological Symptoms/Irritability/nihms-1020336.pdf""]"
AA092,Alcohol intake,What could be the possible negative impacts of consuming alcohol for a family member who has Mild Cognitive Impairment?,"Consuming alcohol can exacerbate the symptoms of Mild Cognitive Impairment (MCI). Alcohol has a neurotoxic effect which can lead to further cognitive decline. It can accelerate memory loss, impair judgment, and increase confusion. Regular or heavy consumption of alcohol can also lead to an increased risk of progression from MCI to dementia. Additionally, alcohol can interact negatively with medications commonly prescribed for MCI, potentially reducing their efficacy or causing undesirable side effects. Overall, it can detrimentally impact the person's cognition, functioning, and quality of life. It's advisable for a person with MCI to limit or avoid alcohol for their health and well-being.",Failed to generate answer after 2 attempts,"[""What's the risk?\nWhat can you do to reduce the risk?\nExcessive alcohol consumption\nDrinking excessively (more than 12\nstandard drinks per week), can increase\nyour risk of developing dementia.\nA “standard drink” means:\n• 341 ml/ 12oz (one bottle) of beer (5% alcohol)\n• 142ml/5 oz wine (12% alcohol)\n• 43 ml/11/2 oz spirit (40% alcohol)\nDrinking may interact with medications that you are taking or\nwith other health-related issues. Talk with your doctor about any\nconcerns you may have.\nLow levels of cognitive engagement\nCognitive engagement is thought\nto support the development of a\n“cognitive reserve”. This is the idea that people\nwho actively use their brains throughout their\nlives may be more protected against brain cell\ndamage caused by dementia.\nBe a lifelong learner! Challenge your brain"", ""● Infections and immune disorders. Dementia-like symptoms can result\nfrom a fever or other side effects of the body's attempt to fight off an\ninfection. Multiple sclerosis and other conditions caused by the body's\nimmune system attacking nerve cells also can cause dementia.\n● Metabolic or endocrine problems. People with thyroid problems and low\nblood sugar can develop dementia-like symptoms or other personality\nchanges. This also is true for people who have too little or too much sodium\nor calcium, or problems absorbing vitamin B-12.\n● Low levels of certain nutrients. Not getting enough of certain vitamins or\nminerals in your diet can cause dementia symptoms. This includes not\ngetting enough thiamin, also known as vitamin B-1, which is common in\npeople with alcohol use disorder. It also in"", ""interventions: A systematic review of systematic reviews and meta‐analyses. Obes Rev. 2021;22(11):e13320.\n203.\nBatterham RL. Weight stigma in healthcare settings is detrimental to health and must be eradicated.\nNature Reviews Endocrinology. 2022;18(7):387-8.\n204.\nLee CM, Woodward M, Batty GD, Beiser AS, Bell S, Berr C, et al. Association of anthropometry and\nweight change with risk of dementia and its major subtypes: A meta-analysis consisting 2.8 million adults with\n57 294 cases of dementia. Obes Rev. 2020;21(4).\n205.\nKivimaki M, Singh-Manoux A, Batty GD, Sabia S, Sommerlad A, Floud S, et al. Association of AlcoholInduced Loss of Consciousness and Overall Alcohol Consumption With Risk for Dementia. Jama Netw Open.\n2020;3(9):e2016084.\n206.\nRehm J, Hasan OSM, Black SE, Shield KD, Schwarzing""]","[null, null, null, null, null, null, null, null, null, null]","[""/Users/gengminjie/Desktop/code/RAG/deployment_package/rag_versions/rag_system/code/downloaded_files/Disease/Risk Factors/Risk-factors_Alzheimer-Society-Canada-2023.pdf"", ""/Users/gengminjie/Desktop/code/RAG/deployment_package/rag_versions/rag_system/code/downloaded_files/Disease/Dementia (mild-moderate-severe)/What is it_ Symptoms_ Causes and risks_ Stages/Mayo_clinic2.pdf"", ""/Users/gengminjie/Desktop/code/RAG/deployment_package/rag_versions/rag_system/code/downloaded_files/Disease/Risk Factors/Livingston_Lancet Commission accepted version.pdf""]"
AA154,Anxiety,What are the typical symptoms of anxiety I should look out for in my family member who has dementia?,"Typical symptoms of anxiety in a person with dementia may include: restlessness or pacing, unexplained agitation or irritability, sleep disturbances, sudden mood changes, excessive worrying or fear, avoidance of social interaction, changes in eating habits, or increase in repetitive behaviors. In severe cases, they can also have panic attacks. It's essential to consult a healthcare professional if you notice these symptoms as combined they could indicate anxiety which needs appropriate treatment.",Failed to generate answer after 2 attempts,"[""● a personality more susceptible to negative feelings\n● other long-term medical conditions or disabilities.\nPeople who have had anxiety in the past are more likely to have it again.\n\nIn the early stage of dementia, anxiety is often related directly to worries\nabout coping with the condition and what the future holds. In the later\nstage of dementia, anxiety may be related more to becoming confused\nor disoriented. For example, a person may worry that they need to go to\nwork or pick up children from school. They may be cared for by someone\nthey don't recognise or feel comfortable with. \n\nThe person may be discouraged from doing things they want to do for\nreasons they don't fully understand, such as going out of the house,\ngetting up during the night, or cooking without someone to help them. I"", ""anxiety and worry that is difficult to control with at least three\nof the following anxiety symptoms: restlessness, fatigue, con\ncentration problems, irritability, muscle tension, and sleep dis\nturbance for 6 months. However, anxiety symptoms such as\nrestlessness, being easily fatigued, and difficulty in concentrat\ning can also frequently occur in dementia patients without\nanxiety.10 It might also be difficult to distinguish between\nsymptoms of anxiety and other behavioral and psychological\nsymptoms of dementia (BPSD) such as irritability, aggression,\nwandering, and sleep disturbance.14 Therefore, anxiety symp\ntoms are often considered a part of dementia itself and some\ntimes it regarded as a nonspecific result of severe dementia,2\nbut this is still unknown.15\nSecond, differentiating anxie"", ""● irritability\n● ‘sundowning': a state of intense confusion and anxiety in the evening\n● sleep changes, eg waking early or sleeping more\n● becoming withdrawn\n● changes in appetite\n● tearfulness\nBecause of the similarity in symptoms, dementia is sometimes misdiagnosed as\nanxiety or depression, which may delay an accurate diagnosis.\nThis can be a particular issue for people who develop dementia symptoms before the\nage of 65 (known as young onset dementia), as some healthcare professionals lack\nawareness of dementia in younger people and how it presents.\nSimilarly, depression or anxiety may be overlooked in a person with dementia as the\nsymptoms may be put down to their dementia.\nDepression-related psychosis may also be missed, as symptoms such as hallucinations\nand delusions may occur in dem""]","[null, null, null, null, null, null, null, null, null, null]","[""/Users/gengminjie/Desktop/code/RAG/deployment_package/rag_versions/rag_system/code/downloaded_files/Psychological Symptoms/Anxiety/What is it_ Symptoms/Anxiety and dementia.pdf"", ""/Users/gengminjie/Desktop/code/RAG/deployment_package/rag_versions/rag_system/code/downloaded_files/Psychological Symptoms/Anxiety/What to do/dnd-16-33.pdf"", ""/Users/gengminjie/Desktop/code/RAG/deployment_package/rag_versions/rag_system/code/downloaded_files/Psychological Symptoms/Anxiety/What to do/DementiaUK Anxiety.pdf""]"
AA164,Apathy,What are the usual indications of apathy in a family member who has dementia?,"Apathy in a family member with dementia can manifest in several ways, including:

1. Lack of interest: They might show no interest in their usual activities or hobbies, or in interacting with family and friends.
2. Reduced social interaction: They may avoid or have no desire for social contact or conversation.
3. Emotionless demeanor: They might not express emotions or feelings as they used to - often appearing indifferent or unmotivated.
4. Reduced activity: They may not engage in as much physical activity, even tasks they previously enjoyed or did regularly.
5. Lack of initiative: They might not start actions or tasks on their own, needing prompting from others and even then they might not respond.
Remember that such symptoms could be due to other factors, so it’s always recommended to consult a healthcare professional for an accurate diagnosis.",Failed to generate answer after 2 attempts,"[""It is important to diagnose depression in people with dementia\nbecause depression may respond to treatment.\nThe symptoms of depression can be similar to symptoms of\ndementia. Therefore, it is often difficult to identify depression\nin people with dementia. There are some common signs of\ndepression to be aware of:\n● Loss of interest in previously enjoyed activities\n● Lack of energy\n● Problems sleeping\n● Increased confusion\n● Loss of appetite and weight\nIf you are concerned about depression, speak to the person's\ndoctor.\nWhat is apathy?\nApathy is a word that describes loss of interest, motivation\nand/or persistence. It means not caring and not being social\nwith others. The person with dementia may develop this\napathy (become apathetic) and feel unmotivated to do\nanything. Apathy can be a symp"", ""Donate\nApathy and dementia\n. Depression and\ndementia\n. Anxiety and\ndementia\n. Apathy and\ndementia\n. Getting treatment\nfor depression, anxiety\nor apathy\nApathy, depression and anxiety\nSave this\ninformation\nApathy in dementia is a loss of\nmotivation or drive. A person may need\na lot of encouragement just to do\nseemingly small things. Without this\nsupport they may well do nothing.\nSome people describe apathy as\nappearing to ‘give up' or withdrawing\ninto a shell. It can be very hard to\nwitness as it may feel like losing the\nWhen the\nmotivation\nis gone:\nsupporting\na person\nwith\ndementia\nwho has\napathy\nPeople with dementia are often more likely to\ndevelop apathy as their condition progresses.\nLearn about the symptoms and causes of apathy,\nand possible ways to treat it for someone who is\nlivi"", ""Read more\nDon't blame the person for being ‘lazy', unhelpful or uncaring\nApathy is not a conscious choice.\nIf you feel frustrated, try to remain as calm as you can.\nBe patient and provide encouragement to keep going\nIt can be tempting to take over or do a task for someone who is struggling. While this may get\nthings done more quickly, it can also knock their confidence and over time, they may lose\nimportant skills.\nBe positive and focus on what they achieve, not on what they can't do.\nFocus on listening and understanding\nAn important part of your support is being able to understand the needs of the person with\ndementia and communicating with them as effectively as possible.\nApathy can also put a strain on family and friends who are trying to help and support them. It\ncan be hard to care fo""]","[null, null, null, null, null, null, null, null, null, null]","[""/Users/gengminjie/Desktop/code/RAG/deployment_package/rag_versions/rag_system/code/downloaded_files/Psychological Symptoms/Apathy/What to do/Overview.pdf"", ""/Users/gengminjie/Desktop/code/RAG/deployment_package/rag_versions/rag_system/code/downloaded_files/Psychological Symptoms/Apathy/What to do/Apathy and dementia _ Alzheimer_s Society.pdf"", ""/Users/gengminjie/Desktop/code/RAG/deployment_package/rag_versions/rag_system/code/downloaded_files/Psychological Symptoms/Apathy/What is it_ Symptoms/apathyalzheimers.org.pdf""]"
AA216,Appetite,What strategies can I use to improve the appetite of a family member with dementia?,"1. Maintain regular meal times: Following a routine can help trigger hunger signals.
2. Make meals enjoyable: The dining environment should be quiet, relaxing, and free of distractions.
3. Finger foods: If dexterity is an issue, provide easy-to-handle foods.
4. Hydration: Ensure they're adequately hydrated. Soups and smoothies can offer additional nutrition.
5. Small portions: Large plates can appear overwhelming; try using smaller plates and servings.
6. Strengthen flavors: Dementia can dull taste buds; enhance taste by using herbs, spices, or lemon juice.
7. Prompt eating: Gentle reminders to eat can be helpful. If needed, demonstrate by eating with them.
8. Be patient: Mealtimes may take longer. Don't rush; make sure they chew and swallow safely.
9. Regular dental checkups: Oral discomfort can hinder appetite. Regularly check for dental issues.
10. Consult a dietitian or doctor if appetite doesn't improve or if weight loss occurs. They can provide strategies targeting specific needs and possibly recommend appetite stimulants.",Failed to generate answer after 2 attempts,"[""Tips and strategies\nResponding to depression\n● Encourage pleasant activities that the person can still\nenjoy, such as short walks or outings.\n● Set realistic expectations. If you expect too much from a\nperson, they may feel frustrated and discouraged.\n● Establish a consistent daily routine. This will help\nreassure the person as well as reduce confusion.\n● Counselling, cognitive behavioural therapy, and group\ntherapy may be helpful.\n● Antidepressant medications may help. Talk to the\nperson's doctor about the options.\nResponding to apathy\n● Try to engage the person with dementia in activities that\nthey enjoy.\n● Make sure that they can participate at all levels and that\nthey are not overwhelmed.\n● Try introducing a small amount of the activity at a time.\n● Choose flexible activities that can "", ""achievement and improve selfesteem.\nDon't blame the person for being ‘lazy',\nunhelpful or uncaring\nApathy is not a conscious choice.\nIf you feel frustrated, try to remain as\ncalm as you can.\nBe patient and provide encouragement\nto keep going\nIt can be tempting to take over or do\na task for someone who is struggling.\nWhile this may get things done more\nquickly, it can also knock their\nconfidence and over time, they may\nlose important skills.\nBe positive and focus on what they\nachieve, not on what they can't do.\nFocus on listening and understanding\nAn important part of your support is\nbeing able to understand the needs\nof the person with dementia and\ncommunicating with them as\neffectively as possible.\nApathy can also put a strain on family\nand friends who are trying to help and\nsupport them."", ""Read more\nDon't blame the person for being ‘lazy', unhelpful or uncaring\nApathy is not a conscious choice.\nIf you feel frustrated, try to remain as calm as you can.\nBe patient and provide encouragement to keep going\nIt can be tempting to take over or do a task for someone who is struggling. While this may get\nthings done more quickly, it can also knock their confidence and over time, they may lose\nimportant skills.\nBe positive and focus on what they achieve, not on what they can't do.\nFocus on listening and understanding\nAn important part of your support is being able to understand the needs of the person with\ndementia and communicating with them as effectively as possible.\nApathy can also put a strain on family and friends who are trying to help and support them. It\ncan be hard to care fo""]","[null, null, null, null, null, null, null, null, null, null]","[""/Users/gengminjie/Desktop/code/RAG/deployment_package/rag_versions/rag_system/code/downloaded_files/Psychological Symptoms/Apathy/What to do/Overview.pdf"", ""/Users/gengminjie/Desktop/code/RAG/deployment_package/rag_versions/rag_system/code/downloaded_files/Psychological Symptoms/Apathy/What to do/Apathy and dementia _ Alzheimer_s Society.pdf"", ""/Users/gengminjie/Desktop/code/RAG/deployment_package/rag_versions/rag_system/code/downloaded_files/Psychological Symptoms/Apathy/What is it_ Symptoms/apathyalzheimers.org.pdf""]"
AA462,Caregiver health risk,"As a caregiver of a family member with dementia, what's the common health risks that caregivers like myself may face?","As a caregiver, especially for someone with dementia, you may face several health risks. These include stress-related conditions such as anxiety, depression, and insomnia, which can lead to more serious complications like heart disease, high blood pressure, or a weakened immune system. Chronic fatigue is common due to the demands of providing round-the-clock care. There's also an increased risk of physical injuries from lifting or assisting your loved one. Lastly, caregivers frequently neglect their own health needs, like skipping their own doctor appointments or not maintaining a balanced diet, which can additionally detriment their health. It's crucial to take care of your own health while caring for a loved one with dementia.",Failed to generate answer after 2 attempts,"[""Support for caregivers and care partners\nProviding care for someone with dementia is physically and emotionally demanding. You might\nfeel angry, guilty, frustrated or worried. Grief and social isolation are common. If you're a\ncaregiver or care partner for someone with dementia:\n● Learn about the disease and participate in caregiver education programs.\n● Find out about supportive services in your community, such as respite care\nor adult care. These services can give you a break from caregiving at\nscheduled times during the week.\n● Ask friends or other family members for help.\n● Take care of your physical, emotional and spiritual health.\n● Ask questions of health care professionals, social workers and others\ninvolved in the care of your loved one.\n● Join a support group.\nPreparing for your "", ""In the middle stage, the person living with Alzheimer's can still\nparticipate in daily activities with assistance. It's important to\nfind out what the person can still do or find ways to simplify\ntasks. As the need for more intensive care increases,\ncaregivers may want to consider respite care or an adult day\ncenter so they can have a temporary break from caregiving\nwhile the person living with Alzheimer's continues to receive\ncare in a safe environment.\n\nLearn more: 10 Signs of Alzheimer's Disease, Diagnosis,\nDiagnosed with Alzheimer's, Types of Dementia, Daily Care,\nand Behaviors\nLate-stage Alzheimer's (severe)\nIn the final stage of the disease, dementia symptoms are\nsevere. Individuals lose the ability to respond to their\nenvironment, to carry on a conversation and, eventually, to\ncontr"", ""● Require around-the-clock assistance with daily personal\ncare.\n● Lose awareness of recent experiences as well as of their\nsurroundings.\n● Experience changes in physical abilities, including walking,\nsitting and, eventually, swallowing.\n● Have difficulty communicating.\n● Become vulnerable to infections, especially pneumonia.\nThe person living with Alzheimer's may not be able to initiate\nengagement as much during the late stage, but he or she can\nstill benefit from interaction in ways that are appropriate, like\nlistening to relaxing music or receiving reassurance through\ngentle touch. During this stage, caregivers may want to use\nsupport services, such as hospice care, which focus on\nproviding comfort and dignity at the end of life. Hospice can be\nof great benefit to people in the final sta""]","[null, null, null, null, null, null, null, null, null, null]","[""/Users/gengminjie/Desktop/code/RAG/deployment_package/rag_versions/rag_system/code/downloaded_files/Disease/Dementia (mild-moderate-severe)/How is it diagnosed_ Cognitive testing, blood testing, what they should look for_/Mayo_clinic3.pdf"", ""/Users/gengminjie/Desktop/code/RAG/deployment_package/rag_versions/rag_system/code/downloaded_files/Disease/Dementia (mild-moderate-severe)/What is it_ Symptoms_ Causes and risks_ Stages/alz.org2.pdf"", ""/Users/gengminjie/Desktop/code/RAG/deployment_package/rag_versions/rag_system/code/downloaded_files/Disease/Dementia (mild-moderate-severe)/What is it_ Symptoms_ Causes and risks_ Stages/alz.org2.pdf""]"
